step_order,phase_bg,page_bg,action_bg,expected_artifact_bg,guard_bg,status_rule_bg
1,Подготовка,План и резултат / Бюджетен съветник,Потребителят има запазен активен бюджетен план преди следващия реален тираж.,models/v94/v94_active_budget_plan_tracker_model.json,"Планът помни последния тираж, след който е запазен, за да няма backfit.",Активният план трябва да е наличен и да има комбинации.
2,Pre-save проверка,Добавяне на тираж,Step 95 оценява активния план със същите въведени числа преди запис в dataset-а.,reports/v95_active_plan_auto_evaluation_latest_result.csv,"Ако тиражът не е след активния план, Step 95 не записва реален резултат.",Статусът е EVALUATED само за реално следващ тираж; иначе остава WAITING/DRAW_NOT_AFTER_ACTIVE_PLAN.
3,Pre-save пакет,Добавяне на тираж,Step 73 оценява текущия пакет преди dataset refresh.,reports/v73_ticket_pack_performance_history.csv,Оценката се прави преди новите числа да станат част от историческите данни.,При грешка записът се спира.
4,Запис,Добавяне на тираж,След успешни проверки новият тираж се записва в historical_draws.csv.,data/historical_draws.csv,Валидни 6 различни числа между 1 и 49; bonus не се смесва с основните числа.,Dataset row count се увеличава само след успешен запис или replace на съществуващо теглене.
5,Обновяване,Добавяне на тираж / Обновяване на анализите,След запис се изпълнява refresh chain за зависимите модели и отчети.,models/ и reports/,"Step 94/95/96/97 са в края на веригата, за да отчетат актуалното състояние.",Всички важни build scripts трябва да минават без грешка.
6,Синхрон,GitHub sync / Контрол на синхрона,След refresh промените се commit/push-ват и Git статусът се изчиства.,Git commit + чист working tree,Не се прави clean ZIP при нечист статус.,git status --short трябва да е празен.
7,Checkpoint,Финален пакет / clean ZIP,Създава се clean ZIP от committed Git state и се проверява строго.,*_FINAL-clean_*.zip,Без helper/cache/temp/patch/nested ZIP файлове и без broken Cyrillic.,"ZIP integrity, compile, JSON/CSV parse и логическите проверки трябва да минат."
